Video Title,Video URL,views,likes,comments
Primos Chibi Tiny Tales | NEW CHIBI SHORT | The Summer of Silenciosa | @disneychannel,https://www.youtube.com/watch?v=ZKO8Yl4dGJU,11000,348,0
🔴 LIVE! | Wizards of Waverly Place Season 1 Full Episodes | 21 THROWBACK Episodes | @disneychannel,https://www.youtube.com/watch?v=ienNmnc5fIc,0,0,0
Wizards Beyond Waverly Place First-Look 👀🪄 | NEW SERIES! | @disneychannel,https://www.youtube.com/watch?v=CqX7X6OfMUE,313000,14000,0
Moon Girl’s Lab Shorts #8 | Save the Moon 🌕 | Marvel’s Moon Girl and Devil Dinosaur |@disneychannel,https://www.youtube.com/watch?v=VbhVBXLd0hM,741400,428,0
Descendants 3 As Told By Chibi  #DisneyDescendants #ChibiTinyTales #DisneyChannel,https://www.youtube.com/watch?v=Xwhi8RpcByM,35000,1700,0
